{
  "flowArn": "arn:aws:appflow:us-east-1:123456789012:flow/my-salesforce-to-s3-flow",
  "description": "Transfer Salesforce accounts to S3 daily",
  "flowName": "my-salesforce-to-s3-flow",
  "flowStatus": "Active",
  "sourceConnectorType": "Salesforce",
  "sourceConnectorLabel": "MyCustomSourceConnector",
  "destinationConnectorType": "S3",
  "destinationConnectorLabel": "MyCustomDestinationConnector",
  "triggerType": "Scheduled",
  "createdAt": 1718153645993
}